"  Niveau d’instruction","",""
"L’activité économique des femmes est plus importante chez celles ayant le niveau préscolaire","",""
"(55,8%)  et  atteint  son  plus  faible  niveau  chez  les  femmes  du  niveau  secondaire  (30,3%).","",""
"Cependant,  elle  demeure  faible  chez  les  femmes  sans  niveau  d’instruction  (45,7%),  chez","",""
"celles ayant le niveau du primaire (45,8%) et celles de niveau d’instruction moyen (32,7%).","",""
"","Il ressort de l’analyse de l’activité économique selon le sexe que les taux d’activité chez les",""
"femmes  sont  moins","importants  que  ceux  des  hommes,","indépendamment  du  niveau"
"","d’instruction  considéré.  En  effet,  l’écart  est  plus  accentué  entre  les  hommes  et  femmes  de",""
"","niveau d’instruction primaire, avec une différence de 24,5 points de pourcentage en faveur des",""
"","hommes. Il est plus faible chez les personnes ayant un niveau d’instruction supérieur, avec",""
"10,1 points de pourcentage au détriment des femmes.","",""
"Graphique XIII-6 : Répartition des taux d’activités par niveau d’instruction selon le sexe","",""
