"•","Situation par rapport à l'occupation"
"L’analyse du nombre de migrants interrégionaux du moment met en évidence l’existence de",""
"variations des migrants récents selon la situation par rapport à l'occupation, représentant 2,6%",""
"dans l’ensemble. A cet effet, la proportion de migrants interrégionaux récents est plus élevée",""
"chez les chômeurs ayant travaillé (en dehors de la période1 de référence) (4,7%) et chez les",""
"personnes occupées (3,3%). En revanche, les proportions les plus faibles sont notées chez",""
"les personnes du troisième âge pensionnées (1,5%) et chez celles non pensionnées (1,8%).",""
"Tableau  VI-14 :  Répartition  (%)  de  la  population  par  situation  par  rapport  à  l'occupation  selon  le  statut",""
"migratoire interrégional du moment (au cours d’une année)",""
