"La coordination de l’Unité de mise en œuvre est assurée par un cadre de l’ANSD nommé par","",""
"le DG de l’ANSD pour toute la durée du projet. Le Coordonnateur de l’Unité de mise en œuvre","",""
"s’appuie sur les chefs de section, les collaborateurs affectés ainsi que sur le personnel recruté","",""
"au sein de l’UMO pour l’exécution de ses missions. Il travaille sous la supervision directe du","",""
"Directeur technique du CTCE du RGPH-5.","",""
"","Les  attributions  de  chaque  composante  du  CTCE  sont  définies  par  la  note  de  service  n°",""
"","004542/MEPC/ANSD/DG du 14 décembre 2021 du Directeur général, portant organigramme",""
"et  attributions  du  CTCE,  de","celles  de","l’UMO  et  de 
ses  différentes 
composantes."
"L’organigramme  du  projet  ainsi  que","les","tâches  assignées  aux  différentes  entités  sont"
"présentés ci-après.","",""
"","La liste complète de l’équipe d’encadrement est présentée en annexe.",""
